{
  "schemaVersion": "1.0.0",
  "identity": {
    "id": "creezio.tasks",
    "title": "Tasks contract fixture",
    "publisher": "creezio",
    "origin": "https://example.invalid/creezio/tasks",
    "version": "1.0.0",
    "source": {
      "kind": "snapshot",
      "revision": "fixture-v1",
      "integrity": "sha256-0000000000000000000000000000000000000000000000000000000000000000"
    },
    "license": {
      "expression": "MIT",
      "file": "LICENSE"
    }
  },
  "compatibility": {
    "core": "^1.0.0",
    "sdk": "^1.0.0",
    "requiredCapabilities": [
      "data.d1.shared",
      "files.r2.shared",
      "runtime.worker"
    ],
    "optionalCapabilities": [
      "ui.mcp-apps"
    ]
  },
  "entrypoints": {
    "server": {
      "path": "module/entry.server.ts",
      "export": "create"
    },
    "ui": {
      "path": "ui/contributions.ts",
      "export": "contributions"
    },
    "plugin": {
      "manifest": "plugin/plugin.json",
      "mcp": "plugin/mcp.json",
      "contributions": {
        "path": "plugin/contributions.ts",
        "export": "contributions"
      }
    }
  },
  "dependencies": [
    {
      "moduleId": "example.catalogue",
      "origin": "https://example.invalid/catalogue",
      "versionRange": "^1.0.0",
      "optional": true,
      "contracts": [],
      "whenAbsent": "disable-contributions",
      "whenIncompatible": "block",
      "autoInstall": false
    }
  ],
  "contracts": {
    "schemas": [
      {
        "id": "task",
        "schema": {
          "type": "object",
          "properties": {
            "id": {
              "type": "string",
              "minLength": 1
            },
            "context_id": {
              "type": "string",
              "minLength": 1
            },
            "owner_id": {
              "type": "string",
              "minLength": 1
            },
            "title": {
              "type": "string",
              "minLength": 1,
              "maxLength": 200
            },
            "record_version": {
              "type": "integer",
              "minimum": 0
            }
          },
          "required": [
            "id",
            "context_id",
            "owner_id",
            "title",
            "record_version"
          ],
          "additionalProperties": false
        }
      },
      {
        "id": "get-input",
        "schema": {
          "type": "object",
          "properties": {
            "id": {
              "type": "string",
              "minLength": 1
            },
            "context_id": {
              "type": "string",
              "minLength": 1
            }
          },
          "required": [
            "id",
            "context_id"
          ],
          "additionalProperties": false
        }
      },
      {
        "id": "list-input",
        "schema": {
          "type": "object",
          "properties": {
            "context_id": {
              "type": "string",
              "minLength": 1
            },
            "cursor": {
              "type": "string"
            },
            "limit": {
              "type": "integer",
              "minimum": 1,
              "maximum": 100
            }
          },
          "required": [
            "context_id",
            "limit"
          ],
          "additionalProperties": false
        }
      },
      {
        "id": "list-output",
        "schema": {
          "type": "object",
          "properties": {
            "items": {
              "type": "array",
              "items": {
                "type": "object",
                "properties": {
                  "id": {
                    "type": "string",
                    "minLength": 1
                  },
                  "title": {
                    "type": "string",
                    "minLength": 1
                  }
                },
                "required": [
                  "id",
                  "title"
                ],
                "additionalProperties": false
              },
              "maxItems": 100
            },
            "cursor": {
              "type": [
                "string",
                "null"
              ]
            }
          },
          "required": [
            "items"
          ],
          "additionalProperties": false
        }
      },
      {
        "id": "update-input",
        "schema": {
          "type": "object",
          "properties": {
            "id": {
              "type": "string",
              "minLength": 1
            },
            "context_id": {
              "type": "string",
              "minLength": 1
            },
            "title": {
              "type": "string",
              "minLength": 1
            },
            "record_version": {
              "type": "integer",
              "minimum": 0
            },
            "request_id": {
              "type": "string",
              "minLength": 1
            }
          },
          "required": [
            "id",
            "context_id",
            "title",
            "record_version",
            "request_id"
          ],
          "additionalProperties": false
        }
      },
      {
        "id": "widget-state",
        "schema": {
          "type": "object",
          "properties": {
            "title": {
              "type": "string",
              "minLength": 1
            },
            "revision": {
              "type": "integer",
              "minimum": 0
            }
          },
          "required": [
            "title",
            "revision"
          ],
          "additionalProperties": false
        }
      },
      {
        "id": "setting-value",
        "schema": {
          "type": "string",
          "maxLength": 256
        }
      }
    ],
    "models": [
      {
        "id": "task",
        "title": "Task",
        "scope": "context",
        "contextField": "context_id",
        "fields": [
          {
            "id": "id",
            "type": "string",
            "nullable": false,
            "protected": true,
            "computed": false
          },
          {
            "id": "context_id",
            "type": "string",
            "nullable": false,
            "protected": true,
            "computed": false
          },
          {
            "id": "owner_id",
            "type": "string",
            "nullable": false,
            "protected": true,
            "computed": false
          },
          {
            "id": "title",
            "type": "string",
            "nullable": false,
            "protected": false,
            "computed": false,
            "constraints": {
              "minLength": 1,
              "maxLength": 200
            }
          },
          {
            "id": "record_version",
            "type": "integer",
            "nullable": false,
            "protected": true,
            "computed": false
          }
        ],
        "primaryKey": [
          "context_id",
          "id"
        ],
        "indexes": [
          {
            "id": "by-owner",
            "fields": [
              "context_id",
              "owner_id"
            ],
            "unique": false
          }
        ],
        "relations": [],
        "permissions": [
          {
            "moduleId": "creezio.tasks",
            "kind": "permission",
            "id": "read"
          },
          {
            "moduleId": "creezio.tasks",
            "kind": "permission",
            "id": "write"
          }
        ],
        "deletion": {
          "mode": "soft",
          "requiresApproval": true
        },
        "public": true
      },
      {
        "id": "attachment-metadata",
        "title": "Private attachment metadata",
        "scope": "context",
        "contextField": "context_id",
        "fields": [
          {
            "id": "id",
            "type": "string",
            "nullable": false,
            "protected": true,
            "computed": false,
            "constraints": {
              "minLength": 1,
              "maxLength": 128
            }
          },
          {
            "id": "context_id",
            "type": "string",
            "nullable": false,
            "protected": true,
            "computed": false,
            "constraints": {
              "minLength": 1,
              "maxLength": 128
            }
          },
          {
            "id": "owner_id",
            "type": "string",
            "nullable": false,
            "protected": true,
            "computed": false,
            "constraints": {
              "minLength": 1,
              "maxLength": 128
            }
          },
          {
            "id": "object_key",
            "type": "string",
            "nullable": false,
            "protected": true,
            "computed": false,
            "constraints": {
              "minLength": 1,
              "maxLength": 1024
            }
          },
          {
            "id": "digest",
            "type": "string",
            "nullable": false,
            "protected": true,
            "computed": false,
            "constraints": {
              "minLength": 64,
              "maxLength": 64
            }
          },
          {
            "id": "byte_size",
            "type": "integer",
            "nullable": false,
            "protected": true,
            "computed": false,
            "constraints": {
              "minimum": 0
            }
          },
          {
            "id": "content_type",
            "type": "string",
            "nullable": false,
            "protected": true,
            "computed": false,
            "constraints": {
              "minLength": 1,
              "maxLength": 128
            }
          },
          {
            "id": "filename",
            "type": "string",
            "nullable": false,
            "protected": true,
            "computed": false,
            "constraints": {